{
  "id": "beginner-case-005",
  "title": "THE IDENTITY CRISIS",
  "description": "Before any investigation, a detective must establish their identity. Configure Git properly.",
  "difficulty": "Beginner",
  "unlock_cost": 0,
  "total_points": 90,
  "created_at": "2026-01-01",
  "story_intro": "The chief slammed the file on my desk. 'Your reports are coming in anonymous! How am I supposed to know who's solving these cases?'\n\nEvery commit needs an author. Every detective needs a badge. Time to configure my identity in the system.\n\nNo more anonymous work.",
  "steps": [
    {
      "instruction": "Set your Git username to 'Detective Noir'.",
      "narrative": "First, establish who I am in this system.",
      "expected_commands": [
        "git config user.name \"Detective Noir\"",
        "git config --global user.name \"Detective Noir\"",
        "git config user.name 'Detective Noir'"
      ],
      "hint": "Configure your Git username",
      "points": 20
    },
    {
      "instruction": "Set your Git email to 'noir@detective.agency'.",
      "narrative": "Every badge needs a contact. My agency email would do.",
      "expected_commands": [
        "git config user.email \"noir@detective.agency\"",
        "git config --global user.email \"noir@detective.agency\"",
        "git config user.email 'noir@detective.agency'"
      ],
      "hint": "Configure your Git email",
      "points": 20
    },
    {
      "instruction": "Verify your configuration by listing all settings.",
      "narrative": "Trust but verify. Let's see if the identity stuck.",
      "expected_commands": [
        "git config --list",
        "git config -l"
      ],
      "hint": "List all Git configuration",
      "points": 25
    },
    {
      "instruction": "Check just the username configuration.",
      "narrative": "Focus on the name - that's what shows on every case file.",
      "expected_commands": [
        "git config user.name"
      ],
      "hint": "Get a specific config value",
      "points": 25
    }
  ]
}
