{
  "id": "case-020",
  "title": "THE ARCHIVE EXTRACTION",
  "description": "Export the repository without Git history. Create clean archives for evidence handoff.",
  "difficulty": "Advanced",
  "unlock_cost": 400,
  "total_points": 190,
  "created_at": "2026-01-01",
  "story_intro": "The prosecution needed the code, but not the Git history. 'Give us the files, not the secrets in the commits.'\n\nGit archive creates clean exports - just the files, no .git folder, no history. Perfect for evidence handoff.\n\nTime to package and deliver.",
  "steps": [
    {
      "instruction": "Create a tar archive of the current HEAD.",
      "narrative": "Package the current state into a tar file.",
      "expected_commands": [
        "git archive -o latest.tar HEAD",
        "git archive --output=latest.tar HEAD"
      ],
      "hint": "Create tar archive of HEAD",
      "points": 40
    },
    {
      "instruction": "Create a zip archive of the 'main' branch.",
      "narrative": "Package for Windows users - they prefer zip.",
      "expected_commands": [
        "git archive -o main.zip main",
        "git archive --format=zip -o main.zip main"
      ],
      "hint": "Create zip archive of a branch",
      "points": 45
    },
    {
      "instruction": "Create an archive of only the 'src' directory.",
      "narrative": "They only need the source code, not everything.",
      "expected_commands": [
        "git archive -o src.tar HEAD src",
        "git archive -o src.tar HEAD -- src"
      ],
      "hint": "Archive specific directory",
      "points": 50
    },
    {
      "instruction": "Create an archive with a prefix directory 'evidence/'.",
      "narrative": "Add a wrapper folder to the archive contents.",
      "expected_commands": [
        "git archive --prefix=evidence/ -o evidence.tar HEAD"
      ],
      "hint": "Archive with prefix directory",
      "points": 55
    }
  ]
}
