{
  "id": "case-013",
  "title": "THE REVERT OPERATION",
  "description": "A bad commit went to production. Undo the damage without erasing history.",
  "difficulty": "Intermediate",
  "unlock_cost": 225,
  "total_points": 145,
  "created_at": "2026-01-01",
  "story_intro": "'The deployment broke everything!' The panicked call came at 3 AM.\n\nSomeone pushed bad code. We couldn't just delete the commit - that would destroy the audit trail. We needed to REVERT - create a new commit that undoes the damage.\n\nClean, traceable, professional.",
  "steps": [
    {
      "instruction": "View the recent commits to find the bad one.",
      "narrative": "First, identify the criminal commit.",
      "expected_commands": [
        "git log --oneline",
        "git log"
      ],
      "hint": "View commit history",
      "points": 25
    },
    {
      "instruction": "Revert the commit with hash 'bad1234'.",
      "narrative": "Create a new commit that undoes the bad one. History preserved.",
      "expected_commands": [
        "git revert bad1234"
      ],
      "hint": "Create a commit that undoes another commit",
      "points": 40
    },
    {
      "instruction": "Revert the last commit using HEAD.",
      "narrative": "The most recent commit was the problem. Undo it.",
      "expected_commands": [
        "git revert HEAD"
      ],
      "hint": "Revert the most recent commit",
      "points": 35
    },
    {
      "instruction": "Revert a commit but don't auto-commit - just stage the changes.",
      "narrative": "I want to review the revert before committing.",
      "expected_commands": [
        "git revert --no-commit HEAD",
        "git revert -n HEAD"
      ],
      "hint": "Revert without automatic commit",
      "points": 45
    }
  ]
}
