{
  "id": "case-009",
  "title": "THE DELETED EVIDENCE",
  "description": "Critical files were removed. Learn to restore what was lost.",
  "difficulty": "Beginner",
  "unlock_cost": 75,
  "total_points": 120,
  "created_at": "2026-01-01",
  "story_intro": "The witness panicked. 'I deleted the evidence by accident! It's gone forever!'\n\nI smiled. In Git, nothing is ever truly gone. The history remembers everything. Time to restore what they thought was lost.\n\n'Relax,' I said. 'I know a few tricks.'",
  "steps": [
    {
      "instruction": "Check the status to see what files are deleted.",
      "narrative": "First, assess the damage. What exactly was removed?",
      "expected_commands": [
        "git status"
      ],
      "hint": "Show working tree status",
      "points": 20
    },
    {
      "instruction": "Restore the deleted file 'evidence.txt' from the last commit.",
      "narrative": "The file exists in history. We just need to pull it back.",
      "expected_commands": [
        "git restore evidence.txt",
        "git checkout -- evidence.txt",
        "git checkout evidence.txt"
      ],
      "hint": "Restore a file from the last commit",
      "points": 30
    },
    {
      "instruction": "Discard all local changes and restore the working directory.",
      "narrative": "Too much was tampered with. Reset everything to the last known good state.",
      "expected_commands": [
        "git restore .",
        "git checkout -- .",
        "git checkout ."
      ],
      "hint": "Restore all files to last commit state",
      "points": 30
    },
    {
      "instruction": "View what a file looked like 2 commits ago using show.",
      "narrative": "I needed to see the file as it was before the tampering began.",
      "expected_commands": [
        "git show HEAD~2:evidence.txt",
        "git show HEAD^^:evidence.txt"
      ],
      "hint": "Show file content from a specific commit",
      "points": 40
    }
  ]
}
