{
  "id": "advanced-case-006",
  "title": "THE CLEAN SWEEP",
  "description": "The repository is cluttered with untracked files. Time for a deep clean.",
  "difficulty": "Advanced",
  "unlock_cost": 350,
  "total_points": 180,
  "created_at": "2026-01-01",
  "story_intro": "The crime scene was contaminated. Hundreds of untracked files - logs, temp files, build artifacts - cluttered everything.\n\n'We need a clean sweep,' I said. 'Remove everything that doesn't belong. Git clean is our broom.'\n\nTime to take out the trash.",
  "steps": [
    {
      "instruction": "Show what untracked files would be removed (dry run).",
      "narrative": "First, see what would be swept away without actually doing it.",
      "expected_commands": [
        "git clean -n",
        "git clean --dry-run"
      ],
      "hint": "Preview clean operation",
      "points": 35
    },
    {
      "instruction": "Remove all untracked files forcefully.",
      "narrative": "Execute the clean sweep. Remove all untracked files.",
      "expected_commands": [
        "git clean -f"
      ],
      "hint": "Force remove untracked files",
      "points": 40
    },
    {
      "instruction": "Remove untracked files AND directories.",
      "narrative": "Go deeper. Remove untracked directories too.",
      "expected_commands": [
        "git clean -fd",
        "git clean -f -d"
      ],
      "hint": "Remove untracked files and directories",
      "points": 45
    },
    {
      "instruction": "Remove untracked files including those ignored by .gitignore.",
      "narrative": "The nuclear option. Remove EVERYTHING untracked.",
      "expected_commands": [
        "git clean -fx",
        "git clean -f -x"
      ],
      "hint": "Remove all untracked, including ignored",
      "points": 60
    }
  ]
}
